ffff9e024d8e0cc0 2871730143 S Co:1:028:0 s 40 01 0008 0000 0000 0
ffff9e024d8e0cc0 2871730227 C Co:1:028:0 0 0


ffff9e024d8e0cc0 2871730456 S Co:1:028:0 s 40 01 0009 0000 0000 0
ffff9e024d8e0cc0 2871730509 C Co:1:028:0 0 0


ffff9e024d8e0cc0 2871730588 S Ci:1:028:0 s a1 21 0000 0000 0007 7 <
ffff9e024d8e0cc0 2871730649 C Ci:1:028:0 0 7 = 80250000 000008


ffff9e00cb450840 2871730873 S Co:1:028:0 s 21 20 0000 0000 0007 7 = 80250000 000008
ffff9e00cb450840 2871730938 C Co:1:028:0 0 7 >

ffff9e00cb450840 2871731001 S Ci:1:028:0 s c0 01 0080 0000 0001 1 <
ffff9e00cb450840 2871731114 C Ci:1:028:0 0 1 = c1


//test

ffff9e01420c3240 3357172282 S Ci:1:033:0 s 80 06 0100 0000 0012 18 <
ffff9e01420c3240 3357172361 C Ci:1:033:0 0 18 = 12011001 00000040 7b060323 00030102 0001
ffff9e01420c3240 3357172421 S Ci:1:033:0 s 80 06 0200 0000 0027 39 <
ffff9e01420c3240 3357172507 C Ci:1:033:0 0 39 = 09022700 01010080 32090400 0003ff00 00000705 81030a00 01070502 02400000
ffff9e01420c3240 3357172863 S Co:1:033:0 s 00 09 0001 0000 0000 0
ffff9e01420c3240 3357172916 C Co:1:033:0 0 0
ffff9e0242e90540 3357176338 C Ii:1:030:1 0:8 4 = 00fa0700
ffff9e0242e90540 3357176380 S Ii:1:030:1 -115:8 4 <
ffff9e016c6756c0 3357176507 S Co:1:033:0 s 40 01 0008 0000 0000 0
ffff9e016c6756c0 3357176542 C Co:1:033:0 0 0
ffff9e016c675c00 3357178377 S Co:1:033:0 s 40 01 0009 0000 0000 0
ffff9e016c675c00 3357178429 C Co:1:033:0 0 0
ffff9e016c675cc0 3357180796 S Ci:1:033:0 s a1 21 0000 0000 0007 7 <
ffff9e016c675cc0 3357180864 C Ci:1:033:0 0 7 = 80250000 000000
ffff9e0209ffca80 3357182840 S Co:1:033:0 s 21 20 0000 0000 0007 7 = 80250000 000008
ffff9e0209ffca80 3357182911 C Co:1:033:0 0 7 >
ffff9e0242e90540 3357184301 C Ii:1:030:1 0:8 4 = 00f90900
ffff9e0242e90540 3357184358 S Ii:1:030:1 -115:8 4 <
ffff9e0209ffc600 3357188353 S Ci:1:033:0 s c0 01 0080 0000 0001 1 <
ffff9e0209ffc600 3357188414 C Ci:1:033:0 0 1 = 00

//testend

//test ati data

ffff89c055faca80 1784039920 S Bo:1:010:2 -115 4 = 4154490d
ffff89c055faca80 1784039958 C Bo:1:010:2 0 4 >
ffff89bfaeb110c0 1784041751 S Bi:1:010:3 -115 1 <
ffff89bf80aff6c0 1784044928 C Ii:1:008:1 0:8 4 = 00fc0600
ffff89bf80aff6c0 1784044945 S Ii:1:008:1 -115:8 4 <

//testend ati adata

// ATI second data set


ffff89bf80a686c0 3368977854 S Ii:1:013:1 -115:1 10 <

ffff89bf80a68c00 3368977857 S Bi:1:013:3 -115 256 <
ffff89bf80a68180 3368977859 S Bi:1:013:3 -115 256 <

ffff89bf719469c0 3368977861 S Co:1:013:0 s 21 22 0003 0000 0000 0
ffff89bf719469c0 3368977889 C Co:1:013:0 0 0
ffff89bf719469c0 3368977911 S Ci:1:013:0 s a1 21 0000 0000 0007 7 <
ffff89bf719469c0 3368977961 C Ci:1:013:0 0 7 = 80250000 000008
ffff89bf719469c0 3368977971 S Ci:1:013:0 s c0 01 0080 0000 0001 1 <
ffff89bf719469c0 3368978014 C Ci:1:013:0 0 1 = c1
ffff89c054666540 3368978026 S Co:1:013:0 s 40 01 0000 0001 0000 0
ffff89c054666540 3368978060 C Co:1:013:0 0 0
ffff89c054666540 3368978084 S Ci:1:013:0 s a1 21 0000 0000 0007 7 <
ffff89c054666540 3368978188 C Ci:1:013:0 0 7 = 80250000 000008
ffff89c054666540 3368978197 S Co:1:013:0 s 21 20 0000 0000 0007 7 = 00960000 000008
ffff89c054666540 3368978246 C Co:1:013:0 0 7 >
ffff89c054666540 3368978255 S Ci:1:013:0 s c0 01 0080 0000 0001 1 <
ffff89c054666540 3368978301 C Ci:1:013:0 0 1 = 01
ffff89c054666540 3368978309 S Co:1:013:0 s 40 01 0000 0001 0000 0
ffff89c054666540 3368978341 C Co:1:013:0 0 0

ffff89bf80a68cc0 3371286227 S Bo:1:013:2 -115 4 = 4154490d
ffff89bf80a68cc0 3371286281 C Bo:1:013:2 0 4 >
ffff89bf80a68c00 3371286841 C Bi:1:013:3 0 1 = 41
ffff89bf80a68c00 3371286874 S Bi:1:013:3 -115 256 <
ffff89bf80a68180 3371287177 C Bi:1:013:3 0 1 = 54
ffff89bf80a68180 3371287216 S Bi:1:013:3 -115 256 <


// ATI data set

ffff9e0248e9c6c0 2874026330 S Bo:1:028:2 -115 4 = 4154490d
ffff9e0248e9c6c0 2874026381 C Bo:1:028:2 0 4 >
ffff9e01d233bb40 2874026936 C Bi:1:028:3 0 1 = 41
ffff9e01d233bb40 2874026967 S Bi:1:028:3 -115 256 <
ffff9e013f3a7300 2874027237 C Bi:1:028:3 0 1 = 54
ffff9e013f3a7300 2874027265 S Bi:1:028:3 -115 256 <
ffff9e01d233bb40 2874027490 C Bi:1:028:3 0 1 = 49
ffff9e01d233bb40 2874027517 S Bi:1:028:3 -115 256 <
ffff9e013f3a7300 2874027747 C Bi:1:028:3 0 1 = 0d
ffff9e013f3a7300 2874027774 S Bi:1:028:3 -115 256 <
ffff9e01d233bb40 2874031193 C Bi:1:028:3 0 1 = 45
ffff9e01d233bb40 2874031224 S Bi:1:028:3 -115 256 <
ffff9e013f3a7300 2874031446 C Bi:1:028:3 0 1 = 4c
ffff9e013f3a7300 2874031471 S Bi:1:028:3 -115 256 <
ffff9e01d233bb40 2874031703 C Bi:1:028:3 0 1 = 4d
ffff9e01d233bb40 2874031721 S Bi:1:028:3 -115 256 <
ffff9e013f3a7300 2874031943 C Bi:1:028:3 0 1 = 33
ffff9e013f3a7300 2874031960 S Bi:1:028:3 -115 256 <
ffff9e01d233bb40 2874032226 C Bi:1:028:3 0 1 = 32
ffff9e01d233bb40 2874032244 S Bi:1:028:3 -115 256 <
ffff9e013f3a7300 2874032493 C Bi:1:028:3 0 1 = 37
ffff9e013f3a7300 2874032509 S Bi:1:028:3 -115 256 <
ffff9e01d233bb40 2874032750 C Bi:1:028:3 0 1 = 20
ffff9e01d233bb40 2874032765 S Bi:1:028:3 -115 256 <
ffff9e013f3a7300 2874032990 C Bi:1:028:3 0 1 = 76
ffff9e013f3a7300 2874033005 S Bi:1:028:3 -115 256 <
ffff9e01d233bb40 2874033257 C Bi:1:028:3 0 1 = 31
ffff9e01d233bb40 2874033273 S Bi:1:028:3 -115 256 <
ffff9e013f3a7300 2874033523 C Bi:1:028:3 0 1 = 2e
ffff9e013f3a7300 2874033551 S Bi:1:028:3 -115 256 <
ffff9e01d233bb40 2874033821 C Bi:1:028:3 0 1 = 35
ffff9e01d233bb40 2874033841 S Bi:1:028:3 -115 256 <
ffff9e013f3a7300 2874034080 C Bi:1:028:3 0 1 = 0d
ffff9e013f3a7300 2874034101 S Bi:1:028:3 -115 256 <
ffff9e01d233bb40 2874034316 C Bi:1:028:3 0 1 = 0d
ffff9e01d233bb40 2874034343 S Bi:1:028:3 -115 256 <
ffff9e013f3a7300 2874034553 C Bi:1:028:3 0 1 = 3e
ffff9e013f3a7300 2874034571 S Bi:1:028:3 -115 256 <


//second data set

ffff9e0200beec00 832490329 S Co:1:033:0 s 40 01 0008 0000 0000 0
ffff9e0200beec00 832490371 C Co:1:033:0 0 0
ffff9e0200beec00 832490380 S Co:1:033:0 s 40 01 0009 0000 0000 0
ffff9e0200beec00 832490410 C Co:1:033:0 0 0
ffff9e0200beec00 832490418 S Ci:1:033:0 s a1 21 0000 0000 0007 7 <
ffff9e0200beec00 832490462 C Ci:1:033:0 0 7 = 80250000 000000
ffff9e0200beec00 832490469 S Co:1:033:0 s 21 20 0000 0000 0007 7 = 80250000 000008
ffff9e0200beec00 832490510 C Co:1:033:0 0 7 >
ffff9e0200beec00 832490516 S Ci:1:033:0 s c0 01 0080 0000 0001 1 <
ffff9e0200beec00 832490591 C Ci:1:033:0 0 1 = 01
ffff9e0200beec00 832490597 S Co:1:033:0 s 40 01 0000 00c1 0000 0
ffff9e0200beec00 832490630 C Co:1:033:0 0 0
ffff9e0122d530c0 832490635 S Ii:1:033:1 -115:1 10 <
ffff9e0122d53e40 832490637 S Bi:1:033:3 -115 256 <
ffff9e0122d53600 832490639 S Bi:1:033:3 -115 256 <
ffff9e0200beec00 832490641 S Co:1:033:0 s 21 22 0003 0000 0000 0
ffff9e0200beec00 832490671 C Co:1:033:0 0 0
ffff9e0200beec00 832490687 S Ci:1:033:0 s a1 21 0000 0000 0007 7 <
ffff9e0200beec00 832490737 C Ci:1:033:0 0 7 = 80250000 000008
ffff9e0200beec00 832490743 S Ci:1:033:0 s c0 01 0080 0000 0001 1 <
ffff9e0200beec00 832490786 C Ci:1:033:0 0 1 = c1
ffff9e0200beec00 832490792 S Co:1:033:0 s 40 01 0000 0001 0000 0
ffff9e0200beec00 832490826 C Co:1:033:0 0 0
ffff9e0200beec00 832490840 S Ci:1:033:0 s a1 21 0000 0000 0007 7 <
ffff9e0200beec00 832490888 C Ci:1:033:0 0 7 = 80250000 000008
ffff9e0200beec00 832490894 S Co:1:033:0 s 21 20 0000 0000 0007 7 = 00960000 000008
ffff9e0200beec00 832490941 C Co:1:033:0 0 7 >
ffff9e0200beec00 832490947 S Ci:1:033:0 s c0 01 0080 0000 0001 1 <
ffff9e0200beec00 832490983 C Ci:1:033:0 0 1 = 01
ffff9e0200beec00 832490989 S Co:1:033:0 s 40 01 0000 0001 0000 0
ffff9e0200beec00 832491023 C Co:1:033:0 0 0
ffff9e0122d530c0 832491588 C Ii:1:033:1 0:1 10 = a1200000 00000200 0006
ffff9e0122d530c0 832491591 S Ii:1:033:1 -115:1 10 <

//first dataset


ffff9e00cb450840 2871731220 S Co:1:028:0 s 40 01 0000 00c1 0000 0
ffff9e00cb450840 2871731267 C Co:1:028:0 0 0
ffff9e013f3bb0c0 2871731336 S Ii:1:028:1 -115:1 10 <
ffff9e01d233bb40 2871731353 S Bi:1:028:3 -115 256 <
ffff9e013f3a7300 2871731357 S Bi:1:028:3 -115 256 <
ffff9e00cb450840 2871731363 S Co:1:028:0 s 21 22 0003 0000 0000 0
ffff9e00cb450840 2871731402 C Co:1:028:0 0 0
ffff9e00cb450840 2871731565 S Ci:1:028:0 s a1 21 0000 0000 0007 7 <
ffff9e00cb450840 2871731642 C Ci:1:028:0 0 7 = 80250000 000008
ffff9e00cb450840 2871731747 S Ci:1:028:0 s c0 01 0080 0000 0001 1 <
ffff9e00cb450840 2871731811 C Ci:1:028:0 0 1 = c1
ffff9e00cb450840 2871731869 S Co:1:028:0 s 40 01 0000 0001 0000 0
ffff9e00cb450840 2871731914 C Co:1:028:0 0 0
ffff9e00cb450840 2871732002 S Ci:1:028:0 s a1 21 0000 0000 0007 7 <
ffff9e00cb450840 2871732172 C Ci:1:028:0 0 7 = 80250000 000008
ffff9e00cb450840 2871732664 S Co:1:028:0 s 21 20 0000 0000 0007 7 = 00960000 000008
ffff9e00cb450840 2871732781 C Co:1:028:0 0 7 >
ffff9e00cb450840 2871732881 S Ci:1:028:0 s c0 01 0080 0000 0001 1 <
ffff9e00cb450840 2871732944 C Ci:1:028:0 0 1 = 01
ffff9e00cb450840 2871733295 S Co:1:028:0 s 40 01 0000 0001 0000 0
ffff9e00cb450840 2871733354 C Co:1:028:0 0 0

ffff9e0248e9c6c0 2874026330 S Bo:1:028:2 -115 4 = 4154490d
ffff9e0248e9c6c0 2874026381 C Bo:1:028:2 0 4 >
ffff9e01d233bb40 2874026936 C Bi:1:028:3 0 1 = 41
ffff9e01d233bb40 2874026967 S Bi:1:028:3 -115 256 <
ffff9e013f3a7300 2874027237 C Bi:1:028:3 0 1 = 54
ffff9e013f3a7300 2874027265 S Bi:1:028:3 -115 256 <
ffff9e01d233bb40 2874027490 C Bi:1:028:3 0 1 = 49
ffff9e01d233bb40 2874027517 S Bi:1:028:3 -115 256 <
ffff9e013f3a7300 2874027747 C Bi:1:028:3 0 1 = 0d
ffff9e013f3a7300 2874027774 S Bi:1:028:3 -115 256 <
ffff9e01d233bb40 2874031193 C Bi:1:028:3 0 1 = 45
ffff9e01d233bb40 2874031224 S Bi:1:028:3 -115 256 <
ffff9e013f3a7300 2874031446 C Bi:1:028:3 0 1 = 4c
ffff9e013f3a7300 2874031471 S Bi:1:028:3 -115 256 <
ffff9e01d233bb40 2874031703 C Bi:1:028:3 0 1 = 4d
ffff9e01d233bb40 2874031721 S Bi:1:028:3 -115 256 <
ffff9e013f3a7300 2874031943 C Bi:1:028:3 0 1 = 33
ffff9e013f3a7300 2874031960 S Bi:1:028:3 -115 256 <
ffff9e01d233bb40 2874032226 C Bi:1:028:3 0 1 = 32
ffff9e01d233bb40 2874032244 S Bi:1:028:3 -115 256 <
ffff9e013f3a7300 2874032493 C Bi:1:028:3 0 1 = 37
ffff9e013f3a7300 2874032509 S Bi:1:028:3 -115 256 <
ffff9e01d233bb40 2874032750 C Bi:1:028:3 0 1 = 20
ffff9e01d233bb40 2874032765 S Bi:1:028:3 -115 256 <
ffff9e013f3a7300 2874032990 C Bi:1:028:3 0 1 = 76
ffff9e013f3a7300 2874033005 S Bi:1:028:3 -115 256 <
ffff9e01d233bb40 2874033257 C Bi:1:028:3 0 1 = 31
ffff9e01d233bb40 2874033273 S Bi:1:028:3 -115 256 <
ffff9e013f3a7300 2874033523 C Bi:1:028:3 0 1 = 2e
ffff9e013f3a7300 2874033551 S Bi:1:028:3 -115 256 <
ffff9e01d233bb40 2874033821 C Bi:1:028:3 0 1 = 35
ffff9e01d233bb40 2874033841 S Bi:1:028:3 -115 256 <
ffff9e013f3a7300 2874034080 C Bi:1:028:3 0 1 = 0d
ffff9e013f3a7300 2874034101 S Bi:1:028:3 -115 256 <
ffff9e01d233bb40 2874034316 C Bi:1:028:3 0 1 = 0d
ffff9e01d233bb40 2874034343 S Bi:1:028:3 -115 256 <
ffff9e013f3a7300 2874034553 C Bi:1:028:3 0 1 = 3e
ffff9e013f3a7300 2874034571 S Bi:1:028:3 -115 256 <

ffff9e00cb3f9780 2875635764 C Ci:1:028:0 0 7 = 00960000 000008
ffff9e00cb3f9780 2875635799 S Co:1:028:0 s 21 20 0000 0000 0007 7 = 80250000 000008
ffff9e00cb3f9780 2875635855 C Co:1:028:0 0 7 >
ffff9e00cb3f9780 2875635877 S Ci:1:028:0 s c0 01 0080 0000 0001 1 <
ffff9e00cb3f9780 2875635923 C Ci:1:028:0 0 1 = 01
ffff9e00cb3f9780 2875635939 S Co:1:028:0 s 40 01 0000 00c1 0000 0
ffff9e00cb3f9780 2875635978 C Co:1:028:0 0 0
ffff9e00cb3f9780 2875928284 S Co:1:028:0 s 21 22 0000 0000 0000 0
ffff9e00cb3f9780 2875928351 C Co:1:028:0 0 0
ffff9e01d233bb40 2875928428 C Bi:1:028:3 -2 0
ffff9e013f3a7300 2875928481 C Bi:1:028:3 -2 0
ffff9e013f3bb0c0 2875928539 C Ii:1:028:1 -2:1 0
ffff9e024d8e0cc0 2875928563 S Co:1:028:0 s 21 23 0000 0000 0000 0
ffff9e024d8e0cc0 2875928599 C Co:1:028:0 0 0


// second data set
ffff9e0200beec00 832490329 S Co:1:033:0 s 40 01 0008 0000 0000 0
ffff9e0200beec00 832490371 C Co:1:033:0 0 0
ffff9e0200beec00 832490380 S Co:1:033:0 s 40 01 0009 0000 0000 0
ffff9e0200beec00 832490410 C Co:1:033:0 0 0
ffff9e0200beec00 832490418 S Ci:1:033:0 s a1 21 0000 0000 0007 7 <
ffff9e0200beec00 832490462 C Ci:1:033:0 0 7 = 80250000 000000
ffff9e0200beec00 832490469 S Co:1:033:0 s 21 20 0000 0000 0007 7 = 80250000 000008
ffff9e0200beec00 832490510 C Co:1:033:0 0 7 >
ffff9e0200beec00 832490516 S Ci:1:033:0 s c0 01 0080 0000 0001 1 <
ffff9e0200beec00 832490591 C Ci:1:033:0 0 1 = 01
ffff9e0200beec00 832490597 S Co:1:033:0 s 40 01 0000 00c1 0000 0
ffff9e0200beec00 832490630 C Co:1:033:0 0 0
ffff9e0122d530c0 832490635 S Ii:1:033:1 -115:1 10 <
ffff9e0122d53e40 832490637 S Bi:1:033:3 -115 256 <
ffff9e0122d53600 832490639 S Bi:1:033:3 -115 256 <
ffff9e0200beec00 832490641 S Co:1:033:0 s 21 22 0003 0000 0000 0
ffff9e0200beec00 832490671 C Co:1:033:0 0 0
ffff9e0200beec00 832490687 S Ci:1:033:0 s a1 21 0000 0000 0007 7 <
ffff9e0200beec00 832490737 C Ci:1:033:0 0 7 = 80250000 000008
ffff9e0200beec00 832490743 S Ci:1:033:0 s c0 01 0080 0000 0001 1 <
ffff9e0200beec00 832490786 C Ci:1:033:0 0 1 = c1
ffff9e0200beec00 832490792 S Co:1:033:0 s 40 01 0000 0001 0000 0
ffff9e0200beec00 832490826 C Co:1:033:0 0 0
ffff9e0200beec00 832490840 S Ci:1:033:0 s a1 21 0000 0000 0007 7 <
ffff9e0200beec00 832490888 C Ci:1:033:0 0 7 = 80250000 000008
ffff9e0200beec00 832490894 S Co:1:033:0 s 21 20 0000 0000 0007 7 = 00960000 000008
ffff9e0200beec00 832490941 C Co:1:033:0 0 7 >
ffff9e0200beec00 832490947 S Ci:1:033:0 s c0 01 0080 0000 0001 1 <
ffff9e0200beec00 832490983 C Ci:1:033:0 0 1 = 01
ffff9e0200beec00 832490989 S Co:1:033:0 s 40 01 0000 0001 0000 0
ffff9e0200beec00 832491023 C Co:1:033:0 0 0
ffff9e0122d530c0 832491588 C Ii:1:033:1 0:1 10 = a1200000 00000200 0006
ffff9e0122d530c0 832491591 S Ii:1:033:1 -115:1 10 <


// init test

ffff89c00a3006c0 1201317025 S Co:1:028:0 s 40 01 0008 0000 0000 0
ffff89c00a3006c0 1201317091 C Co:1:028:0 0 0
ffff89c0e681eb40 1201321401 S Co:1:028:0 s 40 01 0009 0000 0000 0
ffff89c0e681eb40 1201321470 C Co:1:028:0 0 0
ffff89c0e681eb40 1201328281 S Ci:1:028:0 s a1 21 0000 0000 0007 7 <
ffff89c0e681eb40 1201328366 C Ci:1:028:0 0 7 = 80250000 000000
ffff89c0e681eb40 1201332389 S Co:1:028:0 s 21 20 0000 0000 0007 7 = 80250000 000008
ffff89c0e681eb40 1201332499 C Co:1:028:0 0 7 >
ffff89bf719bfcc0 1201337825 S Ci:1:028:0 s c0 01 0080 0000 0001 1 <
ffff89bf719bfcc0 1201338115 C Ci:1:028:0 0 1 = 00
ffff89bf719bfb40 1201347524 S Co:1:028:0 s 40 01 0000 00c1 0000 0
ffff89bf719bfb40 1201347614 C Co:1:028:0 0 0
ffff89c0e681eb40 1201353317 S Ii:1:028:1 -115:1 10 <
ffff89c0e681eb40 1201353681 C Ii:1:028:1 0:1 10 = a1200000 00000200 8006
ffff89c1185e8d80 1201353758 S Bi:1:028:3 -115 256 <
ffff89c1121d8840 1201353876 S Bi:1:028:3 -115 256 <
ffff89bd4317b0c0 1201353942 S Co:1:028:0 s 21 22 0003 0000 0000 0
ffff89bd4317b0c0 1201355143 C Co:1:028:0 0 0
ffff89bd4317b840 1201361355 S Ii:1:028:1 -115:1 10 <
ffff89bd4317b0c0 1201363831 S Ci:1:028:0 s a1 21 0000 0000 0007 7 <
ffff89bd4317b0c0 1201363915 C Ci:1:028:0 0 7 = 80250000 000008
ffff89bd4317b0c0 1201367788 S Ci:1:028:0 s c0 01 0080 0000 0001 1 <
ffff89bd4317b0c0 1201367866 C Ci:1:028:0 0 1 = c1
ffff89bd4317b0c0 1201374384 S Co:1:028:0 s 40 01 0000 0001 0000 0
ffff89bd4317b0c0 1201374450 C Co:1:028:0 0 0
ffff89bd4317b0c0 1201377623 S Ci:1:028:0 s a1 21 0000 0000 0007 7 <
ffff89bd4317b0c0 1201377718 C Ci:1:028:0 0 7 = 80250000 000008
ffff89bd4317b0c0 1201381309 S Co:1:028:0 s 21 20 0000 0000 0007 7 = 00960000 000008
ffff89bd4317b0c0 1201381383 C Co:1:028:0 0 7 >
ffff89bd4317b0c0 1201386410 S Ci:1:028:0 s c0 01 0080 0000 0001 1 <
ffff89bd4317b0c0 1201386490 C Ci:1:028:0 0 1 = 01
ffff89bd4317b0c0 1201391948 S Co:1:028:0 s 40 01 0000 0001 0000 0
ffff89bd4317b0c0 1201392009 C Co:1:028:0 0 0
ffff89bd4317b0c0 1201406689 S Bo:1:028:2 -115 4 = 4154490d
ffff89bd4317b0c0 1201406726 C Bo:1:028:2 0 4 >


// init testend


// full default

ffff89bfc2fbfd80 3794114249 S Co:1:023:0 s 40 01 0008 0000 0000 0
ffff89bfc2fbfd80 3794114321 C Co:1:023:0 0 0

ffff89bfc2fbfd80 3794114353 S Co:1:023:0 s 40 01 0009 0000 0000 0
ffff89bfc2fbfd80 3794114393 C Co:1:023:0 0 0

ffff89bfc2fbfd80 3794114419 S Ci:1:023:0 s a1 21 0000 0000 0007 7 <
ffff89bfc2fbfd80 3794114505 C Ci:1:023:0 0 7 = 80250000 000000
ffff89bfc2fbfd80 3794114606 S Co:1:023:0 s 21 20 0000 0000 0007 7 = 80250000 000008
ffff89bfc2fbfd80 3794114674 C Co:1:023:0 0 7 >

ffff89bfc2fbfd80 3794114701 S Ci:1:023:0 s c0 01 0080 0000 0001 1 <
ffff89bfc2fbfd80 3794114771 C Ci:1:023:0 0 1 = 01

ffff89bfc2fbfd80 3794114801 S Co:1:023:0 s 40 01 0000 00c1 0000 0
ffff89bfc2fbfd80 3794114843 C Co:1:023:0 0 0

ffff89bffb664480 3794114873 S Ii:1:023:1 -115:1 10 <
ffff89bf719466c0 3794114880 S Bi:1:023:3 -115 256 <
ffff89bf71946000 3794114885 S Bi:1:023:3 -115 256 <
ffff89bfc2fbfd80 3794114891 S Co:1:023:0 s 21 22 0003 0000 0000 0
ffff89bfc2fbfd80 3794114931 C Co:1:023:0 0 0
ffff89bfc2fbfd80 3794114992 S Ci:1:023:0 s a1 21 0000 0000 0007 7 <
ffff89bfc2fbfd80 3794115050 C Ci:1:023:0 0 7 = 80250000 000008
ffff89c0c204b9c0 3794115141 S Ci:1:023:0 s c0 01 0080 0000 0001 1 <
ffff89c0c204b9c0 3794115215 C Ci:1:023:0 0 1 = c1
ffff89c0c204b9c0 3794115240 S Co:1:023:0 s 40 01 0000 0001 0000 0
ffff89c0c204b9c0 3794115285 C Co:1:023:0 0 0


ffff89bffb664480 3794115502 C Ii:1:023:1 0:1 10 = a1200000 00000200 0006
ffff89bffb664480 3794115520 S Ii:1:023:1 -115:1 10 <
ffff89c0c204b9c0 3794115899 S Ci:1:023:0 s a1 21 0000 0000 0007 7 <
ffff89c0c204b9c0 3794115976 C Ci:1:023:0 0 7 = 80250000 000008
ffff89c0c204b9c0 3794116076 S Co:1:023:0 s 21 20 0000 0000 0007 7 = 00960000 000008
ffff89c0c204b9c0 3794116143 C Co:1:023:0 0 7 >
ffff89c0c204b9c0 3794116456 S Ci:1:023:0 s c0 01 0080 0000 0001 1 <
ffff89c0c204b9c0 3794116532 C Ci:1:023:0 0 1 = 01
ffff89c0c204b9c0 3794116632 S Co:1:023:0 s 40 01 0000 0001 0000 0
ffff89c0c204b9c0 3794116688 C Co:1:023:0 0 0


ffff89bf71946240 3797190557 S Bo:1:023:2 -115 4 = 4154490d
ffff89bf71946240 3797190611 C Bo:1:023:2 0 4 >
ffff89bf719466c0 3797191193 C Bi:1:023:3 0 1 = 41
ffff89bf719466c0 3797191226 S Bi:1:023:3 -115 256 <
ffff89bf71946000 3797191515 C Bi:1:023:3 0 1 = 54
ffff89bf71946000 3797191538 S Bi:1:023:3 -115 256 <

ffff89bf719466c0 3797191696 C Bi:1:023:3 0 1 = 49
ffff89bf719466c0 3797191706 S Bi:1:023:3 -115 256 <
ffff89bf71946000 3797191966 C Bi:1:023:3 0 1 = 0d
ffff89bf71946000 3797191976 S Bi:1:023:3 -115 256 <
ffff89bf719466c0 3797195435 C Bi:1:023:3 0 1 = 45
ffff89bf719466c0 3797195467 S Bi:1:023:3 -115 256 <
ffff89bf71946000 3797195649 C Bi:1:023:3 0 1 = 4c
ffff89bf71946000 3797195662 S Bi:1:023:3 -115 256 <
ffff89bf719466c0 3797195952 C Bi:1:023:3 0 1 = 4d
ffff89bf719466c0 3797195985 S Bi:1:023:3 -115 256 <
ffff89bf71946000 3797196169 C Bi:1:023:3 0 1 = 33
ffff89bf71946000 3797196183 S Bi:1:023:3 -115 256 <
ffff89bf719466c0 3797196436 C Bi:1:023:3 0 1 = 32
ffff89bf719466c0 3797196468 S Bi:1:023:3 -115 256 <
ffff89bf71946000 3797196694 C Bi:1:023:3 0 1 = 37
ffff89bf71946000 3797196713 S Bi:1:023:3 -115 256 <
ffff89bf719466c0 3797196957 C Bi:1:023:3 0 1 = 20
ffff89bf719466c0 3797197006 S Bi:1:023:3 -115 256 <
ffff89bf71946000 3797197216 C Bi:1:023:3 0 1 = 76
ffff89bf71946000 3797197236 S Bi:1:023:3 -115 256 <
ffff89bf719466c0 3797197514 C Bi:1:023:3 0 1 = 31
ffff89bf719466c0 3797197536 S Bi:1:023:3 -115 256 <
ffff89bf71946000 3797197722 C Bi:1:023:3 0 1 = 2e
ffff89bf71946000 3797197739 S Bi:1:023:3 -115 256 <
ffff89bf719466c0 3797197990 C Bi:1:023:3 0 1 = 35
ffff89bf719466c0 3797198012 S Bi:1:023:3 -115 256 <
ffff89bf71946000 3797198255 C Bi:1:023:3 0 1 = 0d
ffff89bf71946000 3797198271 S Bi:1:023:3 -115 256 <
ffff89bf719466c0 3797198515 C Bi:1:023:3 0 1 = 0d
ffff89bf719466c0 3797198537 S Bi:1:023:3 -115 256 <
ffff89bf71946000 3797198777 C Bi:1:023:3 0 1 = 3e
ffff89bf71946000 3797198803 S Bi:1:023:3 -115 256 <


ffff89c0605e2300 3798644239 S Co:1:023:0 s 21 22 0000 0000 0000 0
ffff89c0605e2300 3798644316 C Co:1:023:0 0 0
ffff89bf719466c0 3798644365 C Bi:1:023:3 -2 0
ffff89bf71946000 3798644578 C Bi:1:023:3 -2 0
ffff89bffb664480 3798644680 C Ii:1:023:1 -2:1 0
ffff89c0c204b9c0 3798644713 S Co:1:023:0 s 21 23 0000 0000 0000 0
ffff89c0c204b9c0 3798644758 C Co:1:023:0 0 0


// full default 2

ffff89bd2fc6fb40 4062257750 S Co:1:024:0 s 40 01 0008 0000 0000 0
ffff89bd2fc6fb40 4062257821 C Co:1:024:0 0 0
ffff89bd2fc6fb40 4062257830 S Co:1:024:0 s 40 01 0009 0000 0000 0
ffff89bd2fc6fb40 4062257877 C Co:1:024:0 0 0
ffff89bd2fc6fb40 4062257887 S Ci:1:024:0 s a1 21 0000 0000 0007 7 <
ffff89bd2fc6fb40 4062257932 C Ci:1:024:0 0 7 = 80250000 000000
ffff89bd2fc6fb40 4062257941 S Co:1:024:0 s 21 20 0000 0000 0007 7 = 80250000 000008
ffff89bd2fc6fb40 4062257986 C Co:1:024:0 0 7 >
ffff89bd2fc6fb40 4062257995 S Ci:1:024:0 s c0 01 0080 0000 0001 1 <
ffff89bd2fc6fb40 4062258034 C Ci:1:024:0 0 1 = 01
ffff89bd2fc6fb40 4062258041 S Co:1:024:0 s 40 01 0000 00c1 0000 0
ffff89bd2fc6fb40 4062258074 C Co:1:024:0 0 0
ffff89bd2fc6f240 4062258081 S Ii:1:024:1 -115:1 10 <
ffff89bd2fc6f480 4062258083 S Bi:1:024:3 -115 256 <
ffff89bd2fc6f000 4062258085 S Bi:1:024:3 -115 256 <
ffff89bd2fc6fb40 4062258086 S Co:1:024:0 s 21 22 0003 0000 0000 0
ffff89bd2fc6fb40 4062258125 C Co:1:024:0 0 0
ffff89bd2fc6fb40 4062258140 S Ci:1:024:0 s a1 21 0000 0000 0007 7 <
ffff89bd2fc6fb40 4062258183 C Ci:1:024:0 0 7 = 80250000 000008
ffff89bd2fc6fb40 4062258189 S Ci:1:024:0 s c0 01 0080 0000 0001 1 <
ffff89bd2fc6fb40 4062258232 C Ci:1:024:0 0 1 = c1
ffff89bd2fc6fb40 4062258238 S Co:1:024:0 s 40 01 0000 0001 0000 0
ffff89bd2fc6fb40 4062258272 C Co:1:024:0 0 0
ffff89bd2fc6fb40 4062258286 S Ci:1:024:0 s a1 21 0000 0000 0007 7 <
ffff89bd2fc6fb40 4062258335 C Ci:1:024:0 0 7 = 80250000 000008
ffff89bd2fc6fb40 4062258341 S Co:1:024:0 s 21 20 0000 0000 0007 7 = 00960000 000008
ffff89bd2fc6fb40 4062258382 C Co:1:024:0 0 7 >
ffff89bd2fc6fb40 4062258388 S Ci:1:024:0 s c0 01 0080 0000 0001 1 <
ffff89bd2fc6fb40 4062258426 C Ci:1:024:0 0 1 = 01
ffff89bd2fc6fb40 4062258432 S Co:1:024:0 s 40 01 0000 0001 0000 0
ffff89bd2fc6fb40 4062258466 C Co:1:024:0 0 0
ffff89bd2fc6f240 4062258870 C Ii:1:024:1 0:1 10 = a1200000 00000200 0006
ffff89bd2fc6f240 4062258872 S Ii:1:024:1 -115:1 10 <

ffff89bd2fc6f600 4066166618 S Bo:1:024:2 -115 4 = 4154490d
ffff89bd2fc6f600 4066166670 C Bo:1:024:2 0 4 >
ffff89bd2fc6f480 4066167219 C Bi:1:024:3 0 1 = 41
ffff89bd2fc6f480 4066167243 S Bi:1:024:3 -115 256 <
ffff89bd2fc6f000 4066167530 C Bi:1:024:3 0 1 = 54
ffff89bd2fc6f000 4066167551 S Bi:1:024:3 -115 256 <
ffff89bd2fc6f480 4066167788 C Bi:1:024:3 0 1 = 49
ffff89bd2fc6f480 4066167807 S Bi:1:024:3 -115 256 <
ffff89bd2fc6f000 4066168088 C Bi:1:024:3 0 1 = 0d
ffff89bd2fc6f000 4066168109 S Bi:1:024:3 -115 256 <
ffff89bf80aff6c0 4066168964 C Ii:1:008:1 0:8 4 = 00fefb00
ffff89bf80aff6c0 4066169016 S Ii:1:008:1 -115:8 4 <
ffff89bd2fc6f480 4066171511 C Bi:1:024:3 0 1 = 45
ffff89bd2fc6f480 4066171531 S Bi:1:024:3 -115 256 <
ffff89bd2fc6f000 4066171781 C Bi:1:024:3 0 1 = 4c
ffff89bd2fc6f000 4066171801 S Bi:1:024:3 -115 256 <
ffff89bd2fc6f480 4066172017 C Bi:1:024:3 0 1 = 4d
ffff89bd2fc6f480 4066172036 S Bi:1:024:3 -115 256 <
ffff89bd2fc6f000 4066172234 C Bi:1:024:3 0 1 = 33
ffff89bd2fc6f000 4066172248 S Bi:1:024:3 -115 256 <
ffff89bd2fc6f480 4066172527 C Bi:1:024:3 0 1 = 32
ffff89bd2fc6f480 4066172540 S Bi:1:024:3 -115 256 <
ffff89bd2fc6f000 4066172811 C Bi:1:024:3 0 1 = 37
ffff89bd2fc6f000 4066172832 S Bi:1:024:3 -115 256 <
ffff89bd2fc6f480 4066173029 C Bi:1:024:3 0 1 = 20
ffff89bd2fc6f480 4066173047 S Bi:1:024:3 -115 256 <
ffff89bd2fc6f000 4066173289 C Bi:1:024:3 0 1 = 76
ffff89bd2fc6f000 4066173305 S Bi:1:024:3 -115 256 <
ffff89bd2fc6f480 4066173555 C Bi:1:024:3 0 1 = 31
ffff89bd2fc6f480 4066173577 S Bi:1:024:3 -115 256 <
ffff89bd2fc6f000 4066173815 C Bi:1:024:3 0 1 = 2e
ffff89bd2fc6f000 4066173831 S Bi:1:024:3 -115 256 <
ffff89bd2fc6f480 4066174098 C Bi:1:024:3 0 1 = 35
ffff89bd2fc6f480 4066174111 S Bi:1:024:3 -115 256 <
ffff89bd2fc6f000 4066174320 C Bi:1:024:3 0 1 = 0d
ffff89bd2fc6f000 4066174331 S Bi:1:024:3 -115 256 <
ffff89bd2fc6f480 4066174576 C Bi:1:024:3 0 1 = 0d
ffff89bd2fc6f480 4066174584 S Bi:1:024:3 -115 256 <
ffff89bd2fc6f000 4066174890 C Bi:1:024:3 0 1 = 3e
ffff89bd2fc6f000 4066174897 S Bi:1:024:3 -115 256 <


// init default (baud: 38400, data bits: 8, flow-control: none, partiy: none, open mode rw, stop bits 1)

ffff89bfaeb11480 459819888 S Co:1:015:0 s 40 01 0008 0000 0000 0
ffff89bfaeb11480 459819927 C Co:1:015:0 0 0
ffff89bfaeb11480 459819934 S Co:1:015:0 s 40 01 0009 0000 0000 0
ffff89bfaeb11480 459819966 C Co:1:015:0 0 0
ffff89c02e9f6300 459819975 S Ci:1:015:0 s a1 21 0000 0000 0007 7 <
ffff89c02e9f6300 459820019 C Ci:1:015:0 0 7 = 80250000 000008
ffff89c02e9f6300 459820025 S Co:1:015:0 s 21 20 0000 0000 0007 7 = 80250000 000008

80250000 000008
00 00 25 80    08 00 00

ffff89c02e9f6300 459820067 C Co:1:015:0 0 7 >
ffff89c02e9f6300 459820073 S Ci:1:015:0 s c0 01 0080 0000 0001 1 <
ffff89c02e9f6300 459820185 C Ci:1:015:0 0 1 = c1
ffff89c02e9f6300 459820191 S Co:1:015:0 s 40 01 0000 00c1 0000 0
ffff89c02e9f6300 459820225 C Co:1:015:0 0 0
ffff89c1122b0a80 459820234 S Ii:1:015:1 -115:1 10 <
ffff89bf719bfcc0 459820236 S Bi:1:015:3 -115 256 <
ffff89bf719bf840 459820237 S Bi:1:015:3 -115 256 <
ffff89c02e9f6300 459820238 S Co:1:015:0 s 21 22 0003 0000 0000 0
ffff89c02e9f6300 459820271 C Co:1:015:0 0 0
ffff89c02e9f6300 459820284 S Ci:1:015:0 s a1 21 0000 0000 0007 7 <
ffff89c02e9f6300 459820327 C Ci:1:015:0 0 7 = 80250000 000008
ffff89c02e9f6300 459820333 S Ci:1:015:0 s c0 01 0080 0000 0001 1 <
ffff89c02e9f6300 459820371 C Ci:1:015:0 0 1 = c1
ffff89bfaeb11900 459820378 S Co:1:015:0 s 40 01 0000 0001 0000 0
ffff89bfaeb11900 459820412 C Co:1:015:0 0 0
ffff89bfaeb11900 459820430 S Ci:1:015:0 s a1 21 0000 0000 0007 7 <
ffff89bfaeb11900 459820501 C Ci:1:015:0 0 7 = 80250000 000008
ffff89bfaeb11900 459820506 S Co:1:015:0 s 21 20 0000 0000 0007 7 = 00960000 000008
ffff89bfaeb11900 459820548 C Co:1:015:0 0 7 >
ffff89bfaeb11900 459820576 S Ci:1:015:0 s c0 01 0080 0000 0001 1 <
ffff89bfaeb11900 459820616 C Ci:1:015:0 0 1 = 01
ffff89bfaeb11900 459820620 S Co:1:015:0 s 40 01 0000 0001 0000 0
ffff89bfaeb11900 459820656 C Co:1:015:0 0 0


// init default 2

ffff89bdee3a8c00 2793865222 S Co:1:020:0 s 40 01 0008 0000 0000 0
ffff89bdee3a8c00 2793865297 C Co:1:020:0 0 0
ffff89bdee3a8c00 2793865327 S Co:1:020:0 s 40 01 0009 0000 0000 0
ffff89bdee3a8c00 2793865364 C Co:1:020:0 0 0
ffff89bdee3a8c00 2793865428 S Ci:1:020:0 s a1 21 0000 0000 0007 7 <
ffff89bdee3a8c00 2793865509 C Ci:1:020:0 0 7 = 80250000 000000
ffff89c0c1cc9180 2793865551 S Co:1:020:0 s 21 20 0000 0000 0007 7 = 80250000 000008
ffff89c0c1cc9180 2793865628 C Co:1:020:0 0 7 >
ffff89c0c1cc9180 2793865654 S Ci:1:020:0 s c0 01 0080 0000 0001 1 <
ffff89c0c1cc9180 2793865702 C Ci:1:020:0 0 1 = 01
ffff89c0c1cc9180 2793865723 S Co:1:020:0 s 40 01 0000 00c1 0000 0
ffff89c0c1cc9180 2793865757 C Co:1:020:0 0 0
ffff89c069a1d240 2793865776 S Ii:1:020:1 -115:1 10 <
ffff89c110b6bb40 2793865781 S Bi:1:020:3 -115 256 <
ffff89c07f233840 2793865785 S Bi:1:020:3 -115 256 <
ffff89c0c1cc9180 2793865790 S Co:1:020:0 s 21 22 0003 0000 0000 0
ffff89c0c1cc9180 2793865823 C Co:1:020:0 0 0
ffff89c0c1cc9180 2793865870 S Ci:1:020:0 s a1 21 0000 0000 0007 7 <
ffff89c0c1cc9180 2793865924 C Ci:1:020:0 0 7 = 80250000 000008
ffff89c0c1cc9180 2793865942 S Co:1:020:0 s 21 20 0000 0000 0007 7 = 80250000 000205
ffff89c0c1cc9180 2793865992 C Co:1:020:0 0 7 >
ffff89c0c1cc9180 2793866008 S Ci:1:020:0 s c0 01 0080 0000 0001 1 <
ffff89c0c1cc9180 2793866056 C Ci:1:020:0 0 1 = c1
ffff89c0c1cc9180 2793866071 S Co:1:020:0 s 40 01 0000 0061 0000 0
ffff89c0c1cc9180 2793866112 C Co:1:020:0 0 0
ffff89c0c1cc9180 2793866157 S Ci:1:020:0 s a1 21 0000 0000 0007 7 <
ffff89c0c1cc9180 2793866213 C Ci:1:020:0 0 7 = 80250000 000205
ffff89c0c1cc9180 2793866230 S Co:1:020:0 s 21 20 0000 0000 0007 7 = c0120000 000205
ffff89c0c1cc9180 2793866280 C Co:1:020:0 0 7 >
ffff89c0c1cc9180 2793866296 S Ci:1:020:0 s c0 01 0080 0000 0001 1 <
ffff89c0c1cc9180 2793866344 C Ci:1:020:0 0 1 = 61
ffff89c0c1cc9180 2793866361 S Co:1:020:0 s 40 01 0000 0061 0000 0
ffff89c0c1cc9180 2793866399 C Co:1:020:0 0 0
ffff89c0c1cc9180 2793866465 S Ci:1:020:0 s a1 21 0000 0000 0007 7 <
ffff89c0c1cc9180 2793866522 C Ci:1:020:0 0 7 = c0120000 000205
ffff89c0c1cc9180 2793866540 S Co:1:020:0 s 21 20 0000 0000 0007 7 = 00960000 000205
ffff89c069a1d240 2793866601 C Ii:1:020:1 0:1 10 = a1200000 00000200 0006
ffff89c069a1d240 2793866606 S Ii:1:020:1 -115:1 10 <
ffff89c0c1cc9180 2793866646 C Co:1:020:0 0 7 >
ffff89c0c1cc9180 2793866666 S Ci:1:020:0 s c0 01 0080 0000 0001 1 <
ffff89c0c1cc9180 2793866711 C Ci:1:020:0 0 1 = 61
ffff89c0c1cc9180 2793866727 S Co:1:020:0 s 40 01 0000 0061 0000 0
ffff89c0c1cc9180 2793866764 C Co:1:020:0 0 0
ffff89c0c1cc9180 2793866801 S Ci:1:020:0 s a1 21 0000 0000 0007 7 <
ffff89c0c1cc9180 2793866857 C Ci:1:020:0 0 7 = 00960000 000205
ffff89c0c1cc9180 2793866878 S Co:1:020:0 s 21 20 0000 0000 0007 7 = 00960000 000208
ffff89c0c1cc9180 2793866925 C Co:1:020:0 0 7 >
ffff89c0c1cc9180 2793866941 S Ci:1:020:0 s c0 01 0080 0000 0001 1 <
ffff89c0c1cc9180 2793866991 C Ci:1:020:0 0 1 = 61
ffff89c0c1cc9180 2793867007 S Co:1:020:0 s 40 01 0000 0061 0000 0
ffff89c0c1cc9180 2793867044 C Co:1:020:0 0 0
ffff89c0c1cc9180 2793867080 S Ci:1:020:0 s a1 21 0000 0000 0007 7 <
ffff89c0c1cc9180 2793867131 C Ci:1:020:0 0 7 = 00960000 000208
ffff89c0c1cc9180 2793867148 S Co:1:020:0 s 21 20 0000 0000 0007 7 = 00960000 000008
ffff89c0c1cc9180 2793867199 C Co:1:020:0 0 7 >
ffff89c0c1cc9180 2793867214 S Ci:1:020:0 s c0 01 0080 0000 0001 1 <
ffff89c0c1cc9180 2793867262 C Ci:1:020:0 0 1 = 61
ffff89c0c1cc9180 2793867278 S Co:1:020:0 s 40 01 0000 0061 0000 0
ffff89c0c1cc9180 2793867315 C Co:1:020:0 0 0
ffff89c0c1cc9180 2793867362 S Ci:1:020:0 s a1 21 0000 0000 0007 7 <
ffff89c0c1cc9180 2793867417 C Ci:1:020:0 0 7 = 00960000 000008
ffff89c0c1cc9180 2793867435 S Ci:1:020:0 s c0 01 0080 0000 0001 1 <
ffff89c0c1cc9180 2793867481 C Ci:1:020:0 0 1 = 61
ffff89c0c1cc9180 2793867497 S Co:1:020:0 s 40 01 0000 0001 0000 0
ffff89c0c1cc9180 2793867605 C Co:1:020:0 0 0


// init 2 (baud: 1200, data bits: 7, flow-control: hardware, partiy: even, open mode r, stop bits 2)

ffff89c055facb40 710153583 S Co:1:015:0 s 40 01 0008 0000 0000 0
ffff89c055facb40 710153648 C Co:1:015:0 0 0
ffff89bf455a5a80 710153659 S Co:1:015:0 s 40 01 0009 0000 0000 0
ffff89bf455a5a80 710153726 C Co:1:015:0 0 0
ffff89bf455a5a80 710153735 S Ci:1:015:0 s a1 21 0000 0000 0007 7 <
ffff89bf455a5a80 710153812 C Ci:1:015:0 0 7 = 80250000 000008
ffff89bf455a5a80 710153821 S Co:1:015:0 s 21 20 0000 0000 0007 7 = 80250000 000008
ffff89bf455a5a80 710153864 C Co:1:015:0 0 7 >
ffff89bf455a5a80 710153869 S Ci:1:015:0 s c0 01 0080 0000 0001 1 <
ffff89bf455a5a80 710153937 C Ci:1:015:0 0 1 = c1
ffff89bf455a5a80 710153942 S Co:1:015:0 s 40 01 0000 00c1 0000 0
ffff89bf455a5a80 710153977 C Co:1:015:0 0 0
ffff89c1122b0a80 710153983 S Ii:1:015:1 -115:1 10 <
ffff89bf719bfcc0 710153984 S Bi:1:015:3 -115 256 <
ffff89bf719bf840 710153985 S Bi:1:015:3 -115 256 <
ffff89bf455a5a80 710153986 S Co:1:015:0 s 21 22 0003 0000 0000 0
ffff89bf455a5a80 710154022 C Co:1:015:0 0 0
ffff89bf455a5a80 710154037 S Ci:1:015:0 s a1 21 0000 0000 0007 7 <
ffff89bf455a5a80 710154081 C Ci:1:015:0 0 7 = 80250000 000008
ffff89bf455a5a80 710154086 S Co:1:015:0 s 21 20 0000 0000 0007 7 = 80250000 020207

80250000 020207
00 00 25 80      07 02 02

ffff89bf455a5a80 710154128 C Co:1:015:0 0 7 >
ffff89bf455a5a80 710154133 S Ci:1:015:0 s c0 01 0080 0000 0001 1 <
ffff89bf455a5a80 710154171 C Ci:1:015:0 0 1 = c1
ffff89bf455a5a80 710154176 S Co:1:015:0 s 40 01 0000 0061 0000 0
ffff89bf455a5a80 710154211 C Co:1:015:0 0 0
ffff89bf455a5a80 710154222 S Ci:1:015:0 s a1 21 0000 0000 0007 7 <
ffff89bf455a5a80 710154271 C Ci:1:015:0 0 7 = 80250000 020207



ffff89bf455a5a80 710154276 S Co:1:015:0 s 21 20 0000 0000 0007 7 = b0040000 020207
b0040000 020207

baud     databits
000004b0 07       02 02



ffff89bf455a5a80 710154318 C Co:1:015:0 0 7 >
ffff89bf455a5a80 710154323 S Ci:1:015:0 s c0 01 0080 0000 0001 1 <
ffff89bf455a5a80 710154361 C Ci:1:015:0 0 1 = 61
ffff89bf455a5a80 710154366 S Co:1:015:0 s 40 01 0000 0061 0000 0
ffff89bf455a5a80 710154401 C Co:1:015:0 0 0


// init 3 (baud: 4800, data bits: 6, flow-control: hardware, partiy: even, open mode r, stop bits 1)

ffff89c05460cc00 1635421938 S Co:1:016:0 s 40 01 0008 0000 0000 0
ffff89c05460cc00 1635421996 C Co:1:016:0 0 0
ffff89beff5cd9c0 1635422007 S Co:1:016:0 s 40 01 0009 0000 0000 0
ffff89beff5cd9c0 1635422039 C Co:1:016:0 0 0
ffff89c05460c3c0 1635422049 S Ci:1:016:0 s a1 21 0000 0000 0007 7 <
ffff89c05460c3c0 1635422100 C Ci:1:016:0 0 7 = 80250000 000000
ffff89c05460c3c0 1635422110 S Co:1:016:0 s 21 20 0000 0000 0007 7 = 80250000 000008
ffff89c05460c3c0 1635422152 C Co:1:016:0 0 7 >
ffff89c05460c3c0 1635422163 S Ci:1:016:0 s c0 01 0080 0000 0001 1 <
ffff89c05460c3c0 1635422203 C Ci:1:016:0 0 1 = 01
ffff89c05460c3c0 1635422217 S Co:1:016:0 s 40 01 0000 00c1 0000 0
ffff89c05460c3c0 1635422244 C Co:1:016:0 0 0
ffff89c00a300000 1635422251 S Ii:1:016:1 -115:1 10 <
ffff89bffbe4ec00 1635422254 S Bi:1:016:3 -115 256 <
ffff89bffbe4e0c0 1635422255 S Bi:1:016:3 -115 256 <
ffff89beff5cdd80 1635422256 S Co:1:016:0 s 21 22 0003 0000 0000 0
ffff89beff5cdd80 1635422287 C Co:1:016:0 0 0
ffff89beff5cdd80 1635422308 S Ci:1:016:0 s a1 21 0000 0000 0007 7 <
ffff89beff5cdd80 1635422359 C Ci:1:016:0 0 7 = 80250000 000008
ffff89beff5cdd80 1635422365 S Ci:1:016:0 s c0 01 0080 0000 0001 1 <
ffff89beff5cdd80 1635422409 C Ci:1:016:0 0 1 = c1
ffff89beff5cdd80 1635422424 S Co:1:016:0 s 40 01 0000 0001 0000 0
ffff89beff5cdd80 1635422456 C Co:1:016:0 0 0
ffff89c05460ccc0 1635422515 S Ci:1:016:0 s a1 21 0000 0000 0007 7 <
ffff89c05460ccc0 1635422562 C Ci:1:016:0 0 7 = 80250000 000008
ffff89beff5cda80 1635422571 S Co:1:016:0 s 21 20 0000 0000 0007 7 = c0120000 000008
ffff89beff5cda80 1635422618 C Co:1:016:0 0 7 >
ffff89beff5cda80 1635422623 S Ci:1:016:0 s c0 01 0080 0000 0001 1 <
ffff89beff5cda80 1635422662 C Ci:1:016:0 0 1 = 01
ffff89beff5cda80 1635422668 S Co:1:016:0 s 40 01 0000 0001 0000 0
ffff89beff5cda80 1635422701 C Co:1:016:0 0 0
ffff89beff5cda80 1635422715 S Ci:1:016:0 s a1 21 0000 0000 0007 7 <
ffff89beff5cda80 1635422765 C Ci:1:016:0 0 7 = c0120000 000008
ffff89beff5cda80 1635422772 S Co:1:016:0 s 21 20 0000 0000 0007 7 = c0120000 000005
ffff89beff5cda80 1635422819 C Co:1:016:0 0 7 >
ffff89c05460c780 1635422841 S Ci:1:016:0 s c0 01 0080 0000 0001 1 <
ffff89c05460c780 1635422885 C Ci:1:016:0 0 1 = 01
ffff89c05460c780 1635422893 S Co:1:016:0 s 40 01 0000 0001 0000 0
ffff89c05460c780 1635422927 C Co:1:016:0 0 0
ffff89c05460c780 1635423041 S Ci:1:016:0 s a1 21 0000 0000 0007 7 <
ffff89c00a300000 1635423076 C Ii:1:016:1 0:1 10 = a1200000 00000200 0006
ffff89c00a300000 1635423077 S Ii:1:016:1 -115:1 10 <
ffff89c05460c780 1635423119 C Ci:1:016:0 0 7 = c0120000 000005
ffff89c05460c780 1635423136 S Co:1:016:0 s 21 20 0000 0000 0007 7 = c0120000 000205
ffff89c05460c780 1635423187 C Co:1:016:0 0 7 >
ffff89beff5cda80 1635423194 S Ci:1:016:0 s c0 01 0080 0000 0001 1 <
ffff89beff5cda80 1635423238 C Ci:1:016:0 0 1 = 01
ffff89beff5cda80 1635423243 S Co:1:016:0 s 40 01 0000 0001 0000 0
ffff89beff5cda80 1635423278 C Co:1:016:0 0 0
ffff89beff5cda80 1635423298 S Ci:1:016:0 s a1 21 0000 0000 0007 7 <
ffff89beff5cda80 1635423347 C Ci:1:016:0 0 7 = c0120000 000205
ffff89beff5cda80 1635423351 S Ci:1:016:0 s c0 01 0080 0000 0001 1 <
ffff89beff5cda80 1635423390 C Ci:1:016:0 0 1 = 01
ffff89beff5cda80 1635423393 S Co:1:016:0 s 40 01 0000 0061 0000 0
ffff89beff5cda80 1635423430 C Co:1:016:0 0 0










// init 4 default screen

ffff8da0f72ef540 2930329657 S Co:1:006:0 s 40 01 0008 0000 0000 0
ffff8da0f72ef540 2930329696 C Co:1:006:0 0 0
ffff8da0f72ef540 2930329705 S Co:1:006:0 s 40 01 0009 0000 0000 0
ffff8da0f72ef540 2930329733 C Co:1:006:0 0 0
ffff8da0f72ef540 2930329741 S Ci:1:006:0 s a1 21 0000 0000 0007 7 <
ffff8da0f72ef540 2930329787 C Ci:1:006:0 0 7 = 80250000 000008
ffff8da0a4dded80 2930329803 S Co:1:006:0 s 21 20 0000 0000 0007 7 = 80250000 000008
ffff8da0a4dded80 2930329852 C Co:1:006:0 0 7 >
ffff8da0a4dded80 2930329900 S Ci:1:006:0 s c0 01 0080 0000 0001 1 <
ffff8da0a4dded80 2930329941 C Ci:1:006:0 0 1 = c1
ffff8da0a4dded80 2930329982 S Co:1:006:0 s 40 01 0000 00c1 0000 0
ffff8da0a4dded80 2930330049 C Co:1:006:0 0 0
ffff8da0f744bf00 2930330062 S Ii:1:006:1 -115:1 10 <
ffff8da0f744b840 2930330064 S Bi:1:006:3 -115 256 <
ffff8da0f744bcc0 2930330066 S Bi:1:006:3 -115 256 <
ffff8da0a4dded80 2930330068 S Co:1:006:0 s 21 22 0003 0000 0000 0
ffff8da0a4dded80 2930330102 C Co:1:006:0 0 0
ffff8da0a4dded80 2930330166 S Ci:1:006:0 s a1 21 0000 0000 0007 7 <
ffff8da0a4dded80 2930330221 C Ci:1:006:0 0 7 = 80250000 000008
ffff8da0a4dded80 2930330230 S Co:1:006:0 s 21 20 0000 0000 0007 7 = 00960000 000008
ffff8da0a4dded80 2930330281 C Co:1:006:0 0 7 >
ffff8da0a4dded80 2930330292 S Ci:1:006:0 s c0 01 0080 0000 0001 1 <
ffff8da0a4dded80 2930330336 C Ci:1:006:0 0 1 = c1
ffff8da0a4dded80 2930330345 S Co:1:006:0 s 40 01 0000 00c1 0000 0
ffff8da0a4dded80 2930330377 C Co:1:006:0 0 0
ffff8da0a4dded80 2930330390 S Co:1:006:0 s 21 22 0003 0000 0000 0
ffff8da0a4dded80 2930330418 C Co:1:006:0 0 0


ffff8da0f744bd80 2932272536 S Bo:1:006:2 -115 3 = 415449
ffff8da0f744bd80 2932272613 C Bo:1:006:2 0 3 >
ffff8da0f744b840 2932273195 C Bi:1:006:3 0 1 = 41
ffff8da0f744b840 2932273224 S Bi:1:006:3 -115 256 <
ffff8da0f744bcc0 2932273534 C Bi:1:006:3 0 1 = 54
ffff8da0f744bcc0 2932273567 S Bi:1:006:3 -115 256 <
ffff8da0f744b840 2932273701 C Bi:1:006:3 0 1 = 49
ffff8da0f744b840 2932273729 S Bi:1:006:3 -115 256 <

// init default (baud: 38400, data bits: 8, flow-control: none, partiy: none, open mode rw, stop bits 1)

ffff89bfaeb11480 459819888 S Co:1:015:0 s 40 01 0008 0000 0000 0
ffff89bfaeb11480 459819927 C Co:1:015:0 0 0
ffff89bfaeb11480 459819934 S Co:1:015:0 s 40 01 0009 0000 0000 0
ffff89bfaeb11480 459819966 C Co:1:015:0 0 0
ffff89c02e9f6300 459819975 S Ci:1:015:0 s a1 21 0000 0000 0007 7 <
ffff89c02e9f6300 459820019 C Ci:1:015:0 0 7 = 80250000 000008
ffff89c02e9f6300 459820025 S Co:1:015:0 s 21 20 0000 0000 0007 7 = 80250000 000008

80250000 000008
00 00 25 80    08 00 00

ffff89c02e9f6300 459820067 C Co:1:015:0 0 7 >
ffff89c02e9f6300 459820073 S Ci:1:015:0 s c0 01 0080 0000 0001 1 <
ffff89c02e9f6300 459820185 C Ci:1:015:0 0 1 = c1
ffff89c02e9f6300 459820191 S Co:1:015:0 s 40 01 0000 00c1 0000 0
ffff89c02e9f6300 459820225 C Co:1:015:0 0 0
ffff89c1122b0a80 459820234 S Ii:1:015:1 -115:1 10 <
ffff89bf719bfcc0 459820236 S Bi:1:015:3 -115 256 <
ffff89bf719bf840 459820237 S Bi:1:015:3 -115 256 <
ffff89c02e9f6300 459820238 S Co:1:015:0 s 21 22 0003 0000 0000 0
ffff89c02e9f6300 459820271 C Co:1:015:0 0 0
ffff89c02e9f6300 459820284 S Ci:1:015:0 s a1 21 0000 0000 0007 7 <
ffff89c02e9f6300 459820327 C Ci:1:015:0 0 7 = 80250000 000008
ffff89c02e9f6300 459820333 S Ci:1:015:0 s c0 01 0080 0000 0001 1 <
ffff89c02e9f6300 459820371 C Ci:1:015:0 0 1 = c1
ffff89bfaeb11900 459820378 S Co:1:015:0 s 40 01 0000 0001 0000 0
ffff89bfaeb11900 459820412 C Co:1:015:0 0 0
ffff89bfaeb11900 459820430 S Ci:1:015:0 s a1 21 0000 0000 0007 7 <
ffff89bfaeb11900 459820501 C Ci:1:015:0 0 7 = 80250000 000008
ffff89bfaeb11900 459820506 S Co:1:015:0 s 21 20 0000 0000 0007 7 = 00960000 000008
ffff89bfaeb11900 459820548 C Co:1:015:0 0 7 >
ffff89bfaeb11900 459820576 S Ci:1:015:0 s c0 01 0080 0000 0001 1 <
ffff89bfaeb11900 459820616 C Ci:1:015:0 0 1 = 01
ffff89bfaeb11900 459820620 S Co:1:015:0 s 40 01 0000 0001 0000 0
ffff89bfaeb11900 459820656 C Co:1:015:0 0 0


// send ATMA

ffff8da0a4401780 2628224513 S Bo:1:012:2 -115 5 = 41544d41 0d
ffff8da0a4401780 2628224573 C Bo:1:012:2 0 5 >
ffff8da0a44019c0 2628225128 C Bi:1:012:3 0 1 = 41
ffff8da0a44019c0 2628225159 S Bi:1:012:3 -115 256 <
ffff8da0a44013c0 2628225403 C Bi:1:012:3 0 1 = 54
ffff8da0a44013c0 2628225429 S Bi:1:012:3 -115 256 <
ffff8da0a44019c0 2628225665 C Bi:1:012:3 0 1 = 4d
ffff8da0a44019c0 2628225681 S Bi:1:012:3 -115 256 <


ffff8d9f497d46c0 2848050941 S Bo:1:012:2 -115 5 = 41544d41 0d
ffff8d9f497d46c0 2848050968 C Bo:1:012:2 0 5 >
ffff8d9f497d46c0 2848051439 S Bi:1:012:3 -115 256 <
ffff8d9f497d46c0 2848051465 C Bi:1:012:3 0 7 = 440d0d3e 54490d
ffff8d9f497d46c0 2848052189 S Bi:1:012:3 -115 256 <
ffff8d9f497d46c0 2848052211 C Bi:1:012:3 0 1 = 3f


// nice ATI


ffff9457a18ee480 3121544254 S Ii:1:010:1 -115:2 16 <
ffff9457a18eed80 3121544259 S Bi:1:010:2 -115 128 <
ffff9457a18ee780 3121544260 S Bi:1:010:2 -115 128 <
ffff9457a18ee840 3121544261 S Bi:1:010:2 -115 128 <
ffff9457a18ee6c0 3121544261 S Bi:1:010:2 -115 128 <
ffff9457a18eea80 3121544261 S Bi:1:010:2 -115 128 <
ffff9457a18ee300 3121544262 S Bi:1:010:2 -115 128 <
ffff945814c770c0 3121544263 S Bi:1:010:2 -115 128 <
ffff945814c77180 3121544263 S Bi:1:010:2 -115 128 <
ffff945814c773c0 3121544264 S Bi:1:010:2 -115 128 <
ffff945814c77a80 3121544264 S Bi:1:010:2 -115 128 <
ffff9455ff640840 3121544264 S Bi:1:010:2 -115 128 <
ffff9455ff640300 3121544265 S Bi:1:010:2 -115 128 <
ffff9455ff640b40 3121544265 S Bi:1:010:2 -115 128 <
ffff9455ff640900 3121544266 S Bi:1:010:2 -115 128 <
ffff945770f6d480 3121544266 S Bi:1:010:2 -115 128 <
ffff945770f6d240 3121544267 S Bi:1:010:2 -115 128 <
ffff9456fc053f00 3121544269 S Co:1:010:0 s 21 22 0003 0000 0000 0
ffff9456fc053f00 3121544329 C Co:1:010:0 0 0
ffff9456c333c6c0 3121544352 S Co:1:010:0 s 21 20 0000 0000 0007 7 = 00960000 000008
ffff9456c333c6c0 3121544463 C Co:1:010:0 0 7 >

ffff945770f6db40 3123619947 S Bo:1:010:2 -115 4 = 4154490d
ffff945770f6db40 3123620018 C Bo:1:010:2 0 4 >
ffff9457a18eed80 3123620161 C Bi:1:010:2 0 21 = 4154490d 0a454c4d 33323720 76322e31 0d0a0d0a 3e
ffff9457a18eed80 3123620212 S Bi:1:010:2 -115 128 <


ffff94571cfdfe40 3125128875 S Co:1:010:0 s 21 20 0000 0000 0007 7 = 80250000 000008
ffff94571cfdfe40 3125129022 C Co:1:010:0 0 7 >
ffff9456fc053d80 3125129143 S Co:1:010:0 s 21 22 0000 0000 0000 0
ffff9456fc053d80 3125129230 C Co:1:010:0 0 0
ffff9457a18ee480 3125129320 C Ii:1:010:1 -2:2 0
ffff9457a18eed80 3125129409 C Bi:1:010:2 -2 0
ffff9457a18ee780 3125129457 C Bi:1:010:2 -2 0
ffff9457a18ee840 3125129497 C Bi:1:010:2 -2 0
ffff9457a18ee6c0 3125129554 C Bi:1:010:2 -2 0
ffff9457a18eea80 3125129589 C Bi:1:010:2 -2 0
ffff9457a18ee300 3125129630 C Bi:1:010:2 -2 0
ffff945814c770c0 3125129669 C Bi:1:010:2 -2 0
ffff945814c77180 3125129708 C Bi:1:010:2 -2 0
ffff945814c773c0 3125129748 C Bi:1:010:2 -2 0
ffff945814c77a80 3125129848 C Bi:1:010:2 -2 0
ffff9455ff640840 3125129888 C Bi:1:010:2 -2 0
ffff9455ff640300 3125129928 C Bi:1:010:2 -2 0
ffff9455ff640b40 3125130028 C Bi:1:010:2 -2 0
ffff9455ff640900 3125130081 C Bi:1:010:2 -2 0
ffff945770f6d480 3125130119 C Bi:1:010:2 -2 0
ffff945770f6d240 3125130158 C Bi:1:010:2 -2 0
